{
  "domain_id": "sign-problem",
  "search_summary": "Searched the web for open problems on the fermion sign problem in quantum Monte Carlo and related many-body methods. Bohrium LKM was not searched: the `gaia` CLI is not installed in this environment (`gaia: command not found`, no binary in the project venv), so LKM routes were unavailable and only web-accessible primary sources were used. Queries covered: sign problem NP-hardness (Troyer-Wiese), complexity of curing non-stoquastic Hamiltonians, easing the sign problem via basis changes, sign problem at quantum critical points (DQMC), PIMC sign problem for degenerate fermions/warm dense matter, and the finite-density lattice QCD sign problem and QCD critical point. Inspected sources: arXiv abstract pages for cond-mat/0408370 (Troyer & Wiese, abstract), 2108.08974 (Mondaini, Tarat & Scalettar, abstract), 1906.02309 (Hangleiter et al., abstract), and 2007.05436 (Alexandru et al. RMP, abstract, used as corroboration); full HTML (ar5iv) of 1802.03408 (Marvian, Lidar & Hen, including its explicit Conclusions and open questions section), 2104.10032 (Dornheim et al., GCE PIMC), and 2108.12423 (Nagata review on finite-density lattice QCD, including its Open problems section). Coverage: complexity-theoretic status, practical severity/scaling in PIMC and DQMC, and the QCD finite-density sign problem; all five returned leads rest on abstract-level-or-stronger inspected material, three on full text. Outcome: five context-grounded leads spanning computational complexity of curing/easing the sign problem, the exponential PIMC wall for degenerate fermions, the doped Hubbard model's low average sign, and the QCD critical point blocked by the sign problem. Limits: no LKM claim/question retrieval was possible; later-literature current-status audits remain for the downstream pipeline.",
  "papers": [],
  "problem_leads": [
    {
      "lead_id": "sign-problem-lead-001",
      "proposed_question": "What is the computational complexity of deciding whether a k-local non-stoquastic Hamiltonian can be cured (transformed into a stoquastic, sign-problem-free form) by a constant-depth quantum circuit that also allows two-qubit rotations, whether discrete or continuous — and can the NP-completeness of finding curing transformations, proven for 3-local and 6-local Hamiltonians under single-qubit Clifford or orthogonal rotations, be extended to 2-local Hamiltonians?",
      "answer_types": [
        "proof",
        "counterexample",
        "construction"
      ],
      "source": {
        "kind": "web",
        "title": "On the Computational Complexity of Curing the Sign Problem",
        "identifier": "arXiv:1802.03408",
        "url": "https://ar5iv.labs.arxiv.org/html/1802.03408",
        "locator": "Section 'Conclusions and open questions'",
        "date": "2019-04-09"
      },
      "exact_excerpt": "It is important to clarify the computational complexity of finding the curing transformation in the case of constant-depth circuits that also allow two-body rotations, whether discrete or continuous.",
      "surrounding_context": "Marvian, Lidar and Hen prove that deciding whether a local Hamiltonian can be cured (made stoquastic, hence sign-problem-free for quantum Monte Carlo) is NP-complete when the allowed transformations are tensor products of single-qubit Clifford gates (3-local Hamiltonians, Theorem 1) or general single-qubit orthogonal matrices (6-local Hamiltonians, Theorem 2). In their 'Conclusions and open questions' section they state: 'It is important to clarify the computational complexity of finding the curing transformation in the case of constant-depth circuits that also allow two-body rotations, whether discrete or continuous. Also, since our NP-completeness proof involved 333 and 666-local Hamiltonians, it is interesting to try to reduce it to 222-local building blocks.' They further ask whether quantum algorithms can cure the sign problem more efficiently than classical ones, and conclude: 'We leave these as open questions to be addressed in future studies.' The 333/666/222 digit forms are ar5iv renderings of 3, 6, and 2 in the original text.",
      "source_intent": "The authors aim to re-found stoquasticity in complexity-theoretic terms ('computational stoquasticity'): after proving NP-completeness of curing under restricted single-qubit transformation classes, they explicitly flag richer transformation classes (constant-depth circuits with two-body rotations), lower locality (2-local), approximate curing (small positive off-diagonal elements), and quantum curing algorithms as unresolved extensions of their hardness results.",
      "derivation_rationale": "The proposed question restates the authors' own explicitly listed open questions without strengthening them: the hardness results are proven only for single-qubit transformation groups and 3-/6-local constructions, so the complexity of curing under constant-depth circuits with two-body rotations and for 2-local Hamiltonians is genuinely undecided by the paper. The question keeps the paper's decision-problem framing (does a curing transformation exist and how hard is it to find), which yields an unambiguous acceptance standard: a complexity classification (membership/hardness proof, algorithm, or counterexample) for the stated transformation class and locality.",
      "authoritative_formulation": null,
      "evidence": [
        {
          "source": "web",
          "identifier": "arXiv:1802.03408",
          "url": "https://ar5iv.labs.arxiv.org/html/1802.03408",
          "content_level": "full_text",
          "supports": "Direct: full HTML text inspected, including Theorems 1-2 (NP-completeness of curing under single-qubit Clifford and orthogonal transformations) and the explicit open-questions list quoted in the excerpt."
        }
      ]
    },
    {
      "lead_id": "sign-problem-lead-002",
      "proposed_question": "Can fermionic path integral Monte Carlo (or any related equilibrium many-body Monte Carlo method) be made to compute thermal properties of quantum-degenerate fermionic systems with computing cost that does not grow exponentially with particle number N and inverse temperature beta, given that the fermion sign problem causes an exponential increase of computing time and is NP-hard in the general case?",
      "answer_types": [
        "proof",
        "construction",
        "simulation",
        "benchmark result"
      ],
      "source": {
        "kind": "web",
        "title": "Fermion Sign Problem in Path Integral Monte Carlo Simulations: Grand-canonical ensemble",
        "identifier": "arXiv:2104.10032",
        "url": "https://ar5iv.labs.arxiv.org/html/2104.10032",
        "locator": "Sections 1 (Introduction) and 2.2 (Fermion sign problem)",
        "date": "2021-04-21"
      },
      "exact_excerpt": "The antisymmetry of the fermionic density matrix under the exchange of particles leads to the notorious fermion sign problem (FSP) [25, 26], which is one of the most fundamental and challenging obstacles in theoretical physics and quantum chemistry.",
      "surrounding_context": "Dornheim analyzes the fermion sign problem in fermionic PIMC simulations of electrons in a 2D harmonic trap, in the grand-canonical ensemble. In the introduction he writes: 'The antisymmetry of the fermionic density matrix under the exchange of particles leads to the notorious fermion sign problem (FSP) [25, 26], which is one of the most fundamental and challenging obstacles in theoretical physics and quantum chemistry.' He then recalls the standard result S = exp(-beta N Delta f) for the average sign and states that this produces 'an exponential wall in fermionic PIMC simulations with respect to N and beta, which can only be compensated by increasing the amount of compute time as ~1/sqrt(N_MC), which inevitably becomes infeasible,' noting the problem 'has been revealed as NP-hard for some cases by Troyer and Wiese'. His new results show the sign problem is even more severe in the grand-canonical ensemble (super-exponential decay of the average sign with chemical potential and decreasing coupling) and that the bosonic reference simulation wastes effort in particle-number sectors irrelevant to fermions.",
      "source_intent": "The author's intent is a practical, quantitative characterization of how the fermion sign problem manifests in PIMC (dependence on temperature, chemical potential, coupling, and ensemble choice), documenting the exponential-to-super-exponential scaling of compute cost and the resulting infeasibility barrier for large, strongly degenerate fermionic systems — thereby identifying the barrier itself as the obstacle to be overcome.",
      "derivation_rationale": "The paper does not claim a generic solution is impossible — it cites Troyer-Wiese only for NP-hardness 'for some cases' — but demonstrates concretely that current fermionic PIMC methodology hits an exponential wall. The possible research question follows faithfully: whether this wall can be circumvented, i.e., whether there exists a method that computes thermal properties of degenerate fermions with sub-exponential cost. This preserves the source's full generality (no restriction to a specific model or temperature window is added). Acceptance is unambiguous: either a proof that no such polynomial-cost method exists (beyond the known special-case NP-hardness), or a construction demonstrated on degenerate fermionic systems with verified cost scaling.",
      "authoritative_formulation": {
        "citation": "M. Troyer and U.-J. Wiese, Computational Complexity and Fundamental Limitations to Fermionic Quantum Monte Carlo Simulations, Phys. Rev. Lett. 94, 170201 (2005), arXiv:cond-mat/0408370",
        "url": "https://arxiv.org/abs/cond-mat/0408370",